name,date,url,header,content,lang,total_word,sentiment
gamemonday,2022/05/04,https://www.gamemonday.com/game-news/187646/,ลุยไม่ต้องยั้งมือไปกับการทดสอบเบต้าแบบปิดครั้งที่ 2 ใน Overprime ได้แล้ววันนี้!, overprime tps moba steam steam steam overprime discordwebsite facebook page overprime ,en,7,Neutral
gamemonday,2022/05/04,https://www.gamemonday.com/game-news/187729/,เหมือนจ๊าดด Genshin Impact คอสเพลย์เป็น Raiden Shogun สุดเบิ้ม,genshin impactraiden shogun hot kisaragiash cosplay genshin impact ,en,7,Positive
gamemonday,2022/05/04,https://www.gamemonday.com/game-news/187470/,หลุดยังไงให้โลกจำ Need For Speed 2022 มาครบทั้งเกมเพลย์ แผนที่และสกรีนช็อต, need for speed ghost games electronic artsneed for speed heatghost gamesneed for speed need for speed gamesneed for speed hot pursuit lake shore city offroadneed for speed payback need for speed electronic arts need for speed need for speed ,en,17,Positive
gamemonday,2022/05/04,https://www.gamemonday.com/game-news/187322/,พลาดไปเสียดายแย่ Monochrome Mobius: Rights and Wrongs Forgotten เกม JRPG เนื้อเรื่องเยี่ยมระดับแรร์ไอเทม,monochrome mobius rights and wrongs forgottenjrpg utawarerumonoaquaplus playstation playstation pc pcdmm gamesshiravune utawarerumononaoya shimokawa munemitsu sugautawarerumono mi monochrome mobius rights and wrongs forgottenrpgmonochrome mobius rights and wrongs forgottenoshtorennakamuyyamato arva shulan utawarerumono aquaplus monochrome mobius rights and wrongs forgotten ,en,23,Neutral
gamemonday,2022/05/04,https://www.gamemonday.com/game-news/187523/,สนุกสนานไปกับเนื้อเรื่องใหม่ ซีซัน 2: เกาะแสงจันทร์  ใน เซเว่นไนท์ 2, rpg pvp hp seven knights facebook pageyoutubeforums seven knights ,en,7,Neutral
gamemonday,2022/05/04,https://www.gamemonday.com/game-news/187955/,เกมแอคชั่นดาร์กเลือดสาด Thymesia มีเดโมมาให้ลองก่อนเปิดฉากล่าฆ่าอสูรร้ายเร็วๆ นี้,action rpg studio playstation xbox series pc thymesia corvus raven thymesia thymesia ,en,10,Positive
gamemonday,2022/05/04,https://www.gamemonday.com/game-news/187954/,อัปเดตครั้งใหม่จาก KOF ALLSTAR ศึกสุดเดือดและคอนเทนต์สุดมันส์จาก The King of Fighters XV ห้ามพลาด!, rpg the king of fighters allstar the king of fighters allstar ex the king of fighters xv pve ex ss ex pve ss the king of fighters allstar ,en,10,Neutral
gamemonday,2022/05/04,https://www.gamemonday.com/game-news/187555/,เกมสาย TD น่าลอง Knightcore Kingdom ชวนผู้กล้าท้ารบปีศาจบน Android สโตร์ SEA วันนี้,cbtseaandroidknightcore games knightcore kingdom td pvp knightcore kingdom knightcore kingdom ,en,6,Neutral
gamemonday,2022/05/04,https://www.gamemonday.com/game-news/187928/,ลงชื่อด่วน Araka จะเปิดวอร์แล้ว 10 พ.ค.นี้ เตรียมยกกิลด์ถล่มเซิร์ฟ SEA,seaarakammorpgappguru technologyumi engine realtime pve pve pvp voice interaction appguru sea araka araka ,en,11,Neutral
gamemonday,2022/05/04,https://www.gamemonday.com/game-news/187938/,Kakao Games เปิดทดสอบ Global Beta Test เกมออนไลน์ ‘Dysterra’ แนว FPS เอาชีวิตรอดใน PC!,kakao games global beta test dysterra fps pc reality magic global beta test dysterra steam dysterrafps multiplay global beta test sf shelter global test dysterra ui ux ai motion capture dysterra global beta test daum cafe steam discord dysterra ,en,23,Positive
gamemonday,2022/05/04,https://www.gamemonday.com/game-news/187902/,พลาดได้ไง  Monster Musume TD ปรับโฉมใหม่พร้อมเปิดจริงให้จัดทีมมอนสาวตะลุยป้อม,early accessdmm games exnoamonster musume td im in trouble because im in love with mon musume on an isolated island in the rpgmist train girlsdressup system curved swordwarrior friend rental system boss challenge training material questexpictorial bookmonster musume td rpgarknightshypergryph monster musume td monster musume td ,en,34,Positive
gamemonday,2022/05/04,https://www.gamemonday.com/game-news/187912/,เปิดตัว The Touhou Empires ไอพี RTS แนวสร้างฐานตีป้อมจากจักรวาล Touhou มาปี 2022,touhou project the touhou empiresrtsneetpiagensokyo defenders phoenixxpc touhou empirestouhou project spell card coop the touhou empires ,en,11,Neutral
gamemonday,2022/05/04,https://www.gamemonday.com/game-news/187882/,คว้ามือถือไปล่าแม่มดกัน MementoMori รับลงทะเบียนผ่าน iOS สโตร์ไทย คาดเปิดจริงมิถุนายนนี้, mementomoriremember you will die live idle rpgbank of innovation iosandroidmementomori church of longinus qlipha gamemonday mementomori mementomori ,en,15,Positive
gamemonday,2022/05/04,https://www.gamemonday.com/game-news/187923/,สุดแค่ไหนไปดู Tower of Fantasy ชวนขี่ม้าเหล็กควบมอไซค์ตะลุยดาวเคราะห์ Aida,level infiniteearly accesstower of fantasy openworld rpg tencent games aida akira aida tower of fantasyaidaopenworld objective omniummaraomnium tower omnium pc ios tower of fantasy tower of fantasy ,en,18,Neutral
gamemonday,2022/05/04,https://www.gamemonday.com/game-news/186451/,ญี่ปุ่นประกาศจัดงานแข่ง Street Fighter V ให้คนตาบอดทั้งหมด !!,eparaesvports shingan cup shingan cup street fighter v epara shingan cup epara youtube shingan cup capcom esports british esports association bea esports street fighter v bbccom,en,14,Neutral
gamemonday,2022/05/04,https://www.gamemonday.com/game-news/186417/,5 เกมมือถือน่าเล่นประจำสัปดาห์ EP. 93, song of the skyazurea song of the sky mmorpg zlonggames loot gb azurea song of the sky my hero academia tshseamy hero academia tshsea action rpg bluetaku pvp openworld gb my hero academia tshsea danganronpa killing harmonydanganronpa killing harmony spike chunsoft class trials debate scrums android ios gb danganronpa killing harmony furryfury smash rollfurryfury smash roll turnbased puzzle cosmic publishing mb furryfury smash roll the ancestral legacythe ancestral legacy story teller buff studio horror mb the ancestral legacy ,en,49,Positive
gamemonday,2022/05/04,https://www.gamemonday.com/game-news/187850/,ตั้งตารอ Bandai จ่อสร้างภาคใหม่จากซีรีส์ SD Gundam G Generation,bandai namcog gene eternalg generation eternal sd gundam g generationstrategyrpg bandaisd gundam g generation cross raysplaystation switch pc steamsquare enixrelic strike g gene eternal sd gundam g generation ,en,18,Neutral
gamemonday,2022/05/04,https://www.gamemonday.com/game-news/186965/,สัมผัสประสบการณ์ซาวด์สเตจที่ดื่มด่ำมากกว่าเดิม ไปกับ Leviathan V2  PC SOUNDBAR ใหม่,razer leviathan razer thx spatial audio razer leviathan downfiring razer leviathan razer leviathan thx spatial audio razer leviathan razer chroma rgb rgb bluetooth razer leviathan razercomrazerstore razer ,en,10,Neutral
gamemonday,2022/05/04,https://www.gamemonday.com/game-news/186599/,AMD ทวงบัลลังก์ CPU เกมมิ่งที่เร็วที่สุดด้วย “Ryzen 7 5800X3D”,cpu amd ryzen intel cpu ryzen tomshardwarecom,en,5,Neutral
gamemonday,2022/05/04,https://www.gamemonday.com/game-news/187892/,Home Sweet Home : Survive ปล่อยเทรลเลอร์ OBT2 ฉบับเต็ม ก่อนเปิดให้เล่น 5 พ.ค. นี้,yggdrazil grouphome sweet home survive new niwarn open beta new niwarn specter survivor website facebook page home sweet home ,en,14,Positive
gamemonday,2022/05/04,https://www.gamemonday.com/game-news/186915/,5 เกมมือถือน่าเล่นประจำสัปดาห์ EP. 94, of god m the great journeytower of god m the great journey action rpg ngel games coop connection skill gb tower of god m the great journey ninnocenceninnocence action rpg asobimo mb ninnocence douluo dalu douluo dalu turnbased mmorpg red river technology corp ip coop gb douluo dalu time defenderstime defenders rpg tower defense vespa inc mb time defenders bomb tankbomb tank turnbased wonderland game mb bomb tank love destiny love destiny mmorpg indofun games gb love destiny ,en,43,Positive
gamemonday,2022/05/04,https://www.gamemonday.com/game-news/187854/,เปิดลงทะเบียนย้อนตำนานจูบกู้โลก Date A Live: Spirit Pledge HD ฉบับรีมาสเตอร์สุดไฉไล,date a live spirit pledge hddate a live spirit pledgekadokawaactiondating sim hd ui date a live iosandroid date a live spirit pledge hdaction rpgdating simulator date a livekoshi tachibanatsunako fujimi shobo date a live rinne utopia date a live arusu install date a live twin edition rio reincarnation date a live ren dystopia date a live spirit pledge date a live spirit pledge hd ,en,28,Positive
gamemonday,2022/05/04,https://www.gamemonday.com/game-news/187624/,5 เกมมือถือน่าเล่นประจำสัปดาห์ EP. 95, of mana globalechoes of mana sidescrolling arpg wright flyer studio mana coop battle raids gb echoes of mana dragon hunters heroes legenddragon hunters heroes legend mmo tthmobi mb dragon hunters heroes legend ragnarok labyrinth nftragnarok labyrinth nft mmorpg playtoearn gravity game link auto play mvp pvp raid mb ragnarok labyrinth nft tenkei paradoxtenkei paradox rpg dmmgames mb tenkei paradox caravan stories academy of magic mbcaravan stories academy of magic action aiming inc caravan stories magic academy mb caravan stories academy of magic seven mortal sins xtasyseven mortal sins xtasy turnbased rpg userjoy technology seven deadly sins gb seven mortal sins xtasy ,en,57,Positive
gamemonday,2022/05/04,https://www.gamemonday.com/game-news/186019/,จบลงอย่างยิ่งใหญ่ การมอบรางวัล Game Talent Showcase Presented by Bitkub 2022, game talent showcase presented by bitkub bitkub chain innovation award kub holy grail extreme disruptive award sponsored by electronics extreme talent of the year bd rising star student award dk best of sound rolling best of narrative best of technology space best of game design best of visual art mash developers choice award audiences choice award play interactive story game contest friendship jaz legologe buzzde jaz friendship digital design creative technology tga thai game software industry association ,en,52,Positive
gamemonday,2022/05/04,https://www.gamemonday.com/game-news/185879/,5 เกมมือถือน่าเล่นประจำสัปดาห์ EP. 92, grand masterspriconne grand masters battle royale auto chess cygames inc ip princess connect hp mb priconne grand masters islands vacationislands vacation kairosoft mb islands vacation yulgang globalyulgang global play to earn tigon mobile wemix mmorpg pvp nft gb yulgang global shiren the wanderershiren the wanderer the tower of fortune and the dice of fate turnbased jrpg spike chunsoft mb shiren the wanderer refantasia charm and conquerrefantasia charm and conquer simulation natasky games limited mb refantasia charm and conquer chronicle of infinitychronicle of infinity action mmorpg neocraft pvp battle royale gb chronicle of infinity ,en,59,Positive
gamemonday,2022/05/04,https://www.gamemonday.com/game-news/187870/,เซิร์ฟแตก Tom Clancy’s Rainbow Six Mobile เปิดเบต้าสาดกระสุน 3 พฤษภาคม,ubisoftbeta testtom clancys rainbow six mobile tom clancys rainbow six siege pvp vs defensetom clancys rainbow six mobilemultiplayer fps shooter rainbow sixbank and bordersecure area and rainbow six mobile tom clancys rainbow six mobile ,en,18,Neutral
