name,date,url,header,content,lang,total_word,sentiment
polygon,2022/05/04,https://www.polygon.com/23055558/weird-al-movie-daniel-radcliffe-trailer-release-date-roku,Daniel Radcliffe is clearly having the time of his life in the ‘Weird Al’ movie,if the casting of daniel radcliffe as weird al yankovic in the upcoming musical biopic about the accordiontickling parody artist hasnt piqued your interest yet perhaps the first trailer for weird the al yankovic story will radcliffe is going all in as yankovic in his early heyday for rokus streaming channel the kind of thing one can do when you have harry potter residuals to cushion your most creative endeavorsweird the al yankovic story holds nothing back roku says of its original film about the grammywinning artist from his meteoric rise to fame with early hits like eat it and like a surgeon to his torrid celebrity love affairs and famously depraved lifestyle yes everyones having a good time herethe teaser trailer doesnt reveal much radcliffe as yankovic performs parodies squeezes the accordion and models a variety of colorful hawaiian shirts shirtsdislikers get a treat too radcliffe looks more shredded than weird al ever did when not prosthetically enhanced that isjoining radcliffe in his weird al biopic are evan rachel wood as madonna and rainn wilson as dr demento al yankovic and eric appel wrote the film appel is directing and his credits include tv series like new girl brooklyn ninenine and ntsfsdsuvheres a quote from weird al about the movie about himself when my last movie uhf came out in i made a solemn vow to my fans that i would release a major motion picture every years like clockwork im very happy to say were on schedule and i am absolutely thrilled that daniel radcliffe will be portraying me in the film i have no doubt whatsoever that this is the role future generations will remember him forweird the al yankovic story hits the roku channel sometime this fall giving you plenty of time to figure out what that channel is,en,188,Positive
polygon,2022/05/04,https://www.polygon.com/23054293/shadow-the-hedgehog-sonic-claires-meme-trend,Shadow the Hedgehog went to Claire’s and inspired a new meme trend,shadow is the brooding antihero of the sonic the hedgehog series created in a lab the poor guy is just trying to understand his place in the world maybe some fresh accessories would help this idea charmed a lot of fans after a meme of shadow entering a claires went viral inspiring a trend where fans draw sonic characters doing some bigbox store shopping of their ownthe format generally works along these lines fans draw a sonic character entering a chain store and place that illustration over a photo of the actual establishment the trend was started by digital artist when they tweeted the image on april since then people have remixed the meme with different sonic characters like knuckles and tails going to mall stores and emerging with new accessoriesshadow the hedgehog walking into claires specific inspired the art i simply just wanted to draw him going to claires said to polygon via twitter it was a self indulgent silly little thing after it took off they redrew the meme with shadow exiting wearing a rainbow plastic bracelet along with a heart shaped shades but did he get his ears pierced maybe next timeupdate shadow the hedgehog has emerged from the claires meme has inspired dozens of spinoffs heres sonic running not walking into the clothing store hot topicsonic the hedgehog walking into hot topic he is emerging from the store it looks like hes changed into some vans got some striped fingerless gloves over his normal gloves and painted the eyeliner on thick he would make any scene kid jealousupdate sonic the hedgehog returns an hour later from hot topic rouge the bat ponders some jewelry at kay jewelers but then steals some in a hurryrouge the bat flying into kay jewelers rouge wait shares his secret to his finesse bath body worksknuckles the echidna walks into bath body works hours later knuckles the echidna has emerged out of the bath body works starline takes a little me time and shops at the sanrio store theyre a competitor but thats finehe back looks absolutely precious holding his buildabear stuffed sonic and knuckles which are real stuffed animals at the moment in case you were wonderingyou never guess what he found the rabbit also looks absolutely adorable with her justice haulupdate they got knock off converse a tiedye shirt and a lisa frank journal blaze the cat goes to a blaze pizza with silver is it a datesilver blaze visits the citywalk pictwittercomtqhrugplywthere are too many to describe each individually so heres a running list of some of the other cute ones we found on twittercream the rabbit walks into a toys r us sonic goes to mcdonalshe is very hapy the hawk walking into a zumiez tails going into gamestop rose walking into justice concept clearly charmed many online and also gave them an opportunity to make some cute fan art its possible that sonic is just top of mind since the new sonic the hedgehog movie was released told polygon they didnt expect so many people to hop on the trend i still dont quite understand how or why i never in my wildest dreams couldve predicted the outcome but im glad it happened lol,en,290,Positive
polygon,2022/05/04,https://www.polygon.com/23055586/dc-league-of-super-pets-trailer-origin-story-lulu-villain#comments,DC’s League of Super-Pets movie has a villain who looks like the Braniac of guinea pigs,superheroes having their own superpets is a longrunning tradition in comics it makes sense a major part of superhero canon is the various relationships they have with their families and coworkers many of whom also have superpowers of their own the new trailer for dc league of superpets is a celebration of these characters and shows a cast of lovable pets come together to save humanityit looks like the movie starts off with krypto supermans dog tutoring a cast of lesser known superpets like ace the bathound kevin hart chip diego luna a squirrel with lightning powers or merton natasha lyonne a turtle with super speed the justice league also show up in the film building friendships with their respective pets however the league is kidnapped by a mysterious guinea pig called lulu what lulu wants the justice league for and her origins will likely be major plot points in the filmwith superman and pals in danger its the superpets that have to band together and save them from lulu it looks like itll follow many of the typical beats of a superhero teamup movie but with a heaping helping of inspiration from the secret life of petsdc league of superpets is set to be released in theaters on july ,en,127,Positive
polygon,2022/05/04,https://www.polygon.com/23055315/warcraft-mobile-game-arclight-rumble,"Blizzard reveals Warcraft Arclight Rumble, a new Warcraft mobile game",warcraft is going mobile with warcraft arclight rumble blizzard entertainment announced tuesday the game a fastpaced freetoplay mobile action strategy game built for android and ios devices will be released later this yearin warcraft arclight rumble players will battle with collectible warcraft minis according to the games google play store description and its official website the warcraft mobile game will feature a massive singleplayer campaign across missions and headtohead pvp battles blizzard says multiple modes including conquest dungeons raids and coop are promised on the games websiteplayers will take control of an army of minis designed to look like tabletop miniatures including hero characters like jaina proudmoore and grommash hellscream blizzard promises over warcraft minis and characters from five playable families alliance horde beast undead and blackrock players will be able to level up their heroes and unlock special abilities and theyll be able to take part in weekly and monthly challenges in warcraft arclight rumble blizzard saysa peek at warcraft arclight rumble gameplay is in the video belowinterested players can preregister for warcraft arclight rumble through the games website and battlenetprior to the announcement of warcraft arclight rumble the only mobile presence for warcraft a franchise more than years old has been in hearthstone that freetoplay game arrived on ios devices in april and for android devices at the end of that year but hearthstone is a cardcollection game altogether different from the actionrpg experience of world of warcraft or the realtime strategy of the first three warcraft titles,en,144,Negative
polygon,2022/05/04,https://www.polygon.com/23055773/overwatch-2-beta-new-heroes-maps-blizzard,"Overwatch 2 beta will get more heroes, maps, and hero reworks, Blizzard says",overwatch pvp beta is still in its early stages and more content is coming before the full game launches that includes new features maps and even additional unannounced heroes blizzard says as well as regular balance changes with an initial focus on the games support castblizzard detailed some of those changes in a developer blog on the official overwatch site on tuesday providing a look at what players can expect over subsequent patcheswhile theres no word on when new heroes beyond sojourn or maps may arrive blizzard shared some of its plans regarding immediate priorities support heroes will be seeing additional buffs since theyve lost an offtank to protect them and are more open to flanking that may also mean reworked abilities something that the support side of overwatch didnt get in overwatch betawe have heard clearly that support players feel both tanks and damage players have more new content to enjoy and explore in this beta blizzard said longer term we believe the most effective way to tackle this issue is to add exciting new support heroes to the game and that is part of our plans in the near term our hero design team is also experimenting with significant but shorter lead time ideas including new and refreshed abilities for some existing support heroesblizzard also touched on changes to overwatchs scoreboard and explained why it retired the medal and fire system in overwatch beta in favor of more granular player statisticsthese statistics include eliminations assists deaths damage damage mitigated and healing blizzard said the information will be presented in a new layout that mirrors other competitive games and sports we want to provide players with an overall more accurate view of the game our team believes providing accurate feedback and encouragement can improve everyones gameplay experienceblizzard was quick to note that the beta test is still a work in progress and elements like menu screens scoreboards heroes new and upgraded looks and the golden gun system are not fully implemented or complete there will be a significant amount of overall polish and refinement added in the form of enhanced ui and bug fixes according to the developer,en,209,Positive
polygon,2022/05/04,https://www.polygon.com/23055479/umbrella-academy-season-3-netflix-first-look,New Umbrella Academy season 3 photos give a glimpse of an alternate timeline,new photos for the upcoming season of the umbrella academy bring two separate realities and two separate sets of hargreeves siblings togetherin the third season of the umbrella academy the hargreeves siblings find themselves in an alternate timeline one where enigmatic reginald hargreeves never adopted them instead reginald adopts a different set of superpowered individuals raising them to be the sparrow academythe original hargreeves siblings dutiful luther tom hopper rebellious diego davida castaeda compassionate allison emmy raverlampman eccentric klaus robert sheehan snarky five aidan gallagher and lonely viktor elliot page must make sense of this new reality where their former sibling ben justin min is now the confident secondincommand of the sparrow academythese new photos also show glimpses of the new characters played by justin cornwell jingle jangle a christmas journey britne oldford hunters jake epstein suits genesis rodriguez big hero and cazzie david unfortunately the most important member of the new crew christopher who is played by existential dread inducing psykronium cube is not pictured so well have to wait to see him in actionthe umbrella academy returns to netflix on june ,en,133,Positive
polygon,2022/05/04,https://www.polygon.com/23055769/the-owl-house-reveal-season-2,The Owl House is proving itself to be too good for Disney,the owl houses past few episodes have showcased the series at its best as plucky misfit luz searches for a way home and also tries to get to the bottom of allpowerful emperor belos plans she grapples with her own emotions about being torn between two worlds its the perfect blend of worldbuilding backstory and characterfocused downtime to balance out the overarching plotbut even though the show has been at its best the fact that the last two episodes had a bunch of big reveals backtobacktoback is frustratingly bittersweet with only four episodes left of this season and only a tiny abridged third season on the horizon its clear that creator dana terrace and the rest of the owl house team are working within the framework handed to them its still deeply satisfying but the show and the team behind it deserve moreed note this article contains major spoilers for the most recent episodes of the owl housein hollow mind luz and hunter zeno robinson emperor belos dutiful nephew find themselves trapped in belos mindscape while trying to escape luz also decides to explore his memories and find out his motivations while hunter passionately insists that belos is good at heart they stumble across a small childlike belos who luz initially wants to protect but as they delve deeper into belos dark and twisted mind it becomes evident that his true intentions are evil he is actually a human witch hunter the very same human that luz went back in time to find in hopes that he could lead her home belos has been working with a shady spirit known as the collector and has somehow survived for hundreds of years in order to carry out his master plan of murdering all the witches and demons in the boiling isles and to top that all off hunter isnt actually his nephew but something he refers to as a grimwalker made in the appearance of one of belos first companions all those years agoif that wasnt enough the very next episode sees luz and baby demon king alex hirsch headed off to a distant part of the boiling isles where they meet a remote clan of titan hunters who are convinced that king is one of their longlost descendants as it turns out king isnt a titan hunter hes actually the last titan the giant fearsome demonic creatures who roamed the boiling isles centuries ago creatures that the aforementioned collector wants to eliminate its whammy after whammy but each of the revelations has been carefully seeded beforehand the king reveal builds on previous instances where we saw him search for his family while belos and hunters true nature was foreshadowed by their inability to wield magical traditionallybut with only a handful of episodes left this season and only an abridged season after this one wrapping them all up seems near impossible terrace and the rest of the crew have already defied odds crafting a gratifying and interesting narrative despite the limited scope handed to them theyve proved that they can pull off the unbelievable and can likely thread the needle to a satisfying ending and yet it could also be so much more had disney not decided to shaft the show before it even really got a chancegenerally disney channel animated shows tend to run for fewer seasons compared to other network counterparts take adventure time and steven universe for instance which clocked in at and episodes respectively not including their respective spinoff series and compare them to popular disney channel shows like gravity falls episodes and star vs the forces of evil episodes that isnt to say that you cant make a satisfying animated show with a smaller episode count its doable and certainly those two disney channel examples already speak to that but it does make it evident that the owl house was already operating under a more restrained storytelling allowance made even shorter by the fact that it wont be getting a full third seasonterrace previously offered some insight into why the owl house wasnt renewed for a full third season which boiled down to a frustratingly simple reason that had nothing to do with reviews all good or viewership also good someone decided that the show didnt fit disneys brandat the end of the day there are a few business people who oversee what fits into the disney brand and one day one of those guys decided toh didnt fit that brand wrote terrace in a reddit ama thread the story is serialized barely compared to any average anime lmao our audience skews older and that just didnt fit this one guys tastes thats it aint that wild really grinds my guts boils my brain kicks my shins all the things it sucks but it is what it ispulling off a lateshow reveal like steven universe did in its final season doesnt just come from the hard work of the creatives involved there were certainly moments along the way where it seemed like steven universe might not get a chance to tell its full story but it takes the network giving the show a chance to even get to that point the owl houses most recent reveals are amazing but imagine what they couldve been like with a little more time to stew hunter for instance was only really introduced this season and the revelation about what he really is comes smooshed in between other big reveals about belos it still works it works very well but its just hard to shake the fact that disney doesnt want it to work at allthe owl house is brilliant its sharp and funny with evocative worldbuilding and compelling characters its funny and heartful and gorgeously animated its garnered a passionate fan base and rave reviews and it became a milestone of lgbtq representation in allages animation its more grownup than the average disney channel animated series and for the better and if disney just had a little more faith trust and pixie dust etc etc then the owl house could have the time it deservesthe first season of the owl house as well as episodes through of season are available on disney plus new episodes premiere on saturdays at am edt on disney channel,en,476,Positive
polygon,2022/05/04,https://www.polygon.com/23013791/the-next-generation-of-everything-2022,The next generation of everything 2022,if you live on the internet you know just how quickly trends come and gonext generation of everything is our celebration of what comes next in these stories polygon digs into the trends that are right on our doorstep in the worlds of entertainment games and fandombut these stories are also about the choices people have made about living on the internet and in many of us have chosen to slow down our online lives and to focus on the fandom communities that are important to us whether its spending time in discord building a roleplaying server eulogizing the sims on tiktok or even eschewing social media altogether in favor of a more deliberate online presencethe future looks bright lets dive in ,en,83,Positive
polygon,2022/05/04,https://www.polygon.com/23055464/save-room-organizational-puzzle-inventory-tetris-game#comments,Save Room is a Resident Evil 4-style ‘inventory Tetris’ puzzler,there are many ways for games to handle the players inventory but few are as elegant as the inventory tetris style used in a few games the most prominent of which is resident evil leon s kennedy had a whole smorgasbord of guns and gear to carry and he did so by rotating items across a grid big and powerful things cover more space but clever players could also pack their case with small useful items like herbs and ammo it was a very small but satisfying part of the game and pc gamer recently highlighted a tribute to that mechanic called save room organization puzzlesave room has the player take the role of a protagonist in a horror game but only at the brief moments where the hero gets to rest wounded and weary and clear their head in order to survive until the next safe spot youll need to organize your gear for the next levels the player has to neatly rotate and place a selection of items across the grid to pack their bagsthe game has some fun puzzles like hauling around a case full of endgame gear or having to mix or consume certain items just to score some more sweet sweet space if you love creating an efficient loadout this is basically the game for you and its currently under two dollars on steam,en,146,Positive
polygon,2022/05/04,https://www.polygon.com/23055586/dc-league-of-super-pets-trailer-origin-story-lulu-villain,DC’s League of Super-Pets movie has a villain who looks like the Braniac of guinea pigs,superheroes having their own superpets is a longrunning tradition in comics it makes sense a major part of superhero canon is the various relationships they have with their families and coworkers many of whom also have superpowers of their own the new trailer for dc league of superpets is a celebration of these characters and shows a cast of lovable pets come together to save humanityit looks like the movie starts off with krypto supermans dog tutoring a cast of lesser known superpets like ace the bathound kevin hart chip diego luna a squirrel with lightning powers or merton natasha lyonne a turtle with super speed the justice league also show up in the film building friendships with their respective pets however the league is kidnapped by a mysterious guinea pig called lulu what lulu wants the justice league for and her origins will likely be major plot points in the filmwith superman and pals in danger its the superpets that have to band together and save them from lulu it looks like itll follow many of the typical beats of a superhero teamup movie but with a heaping helping of inspiration from the secret life of petsdc league of superpets is set to be released in theaters on july ,en,127,Positive
polygon,2022/05/04,https://www.polygon.com/23055464/save-room-organizational-puzzle-inventory-tetris-game,Save Room is a Resident Evil 4-style ‘inventory Tetris’ puzzler,there are many ways for games to handle the players inventory but few are as elegant as the inventory tetris style used in a few games the most prominent of which is resident evil leon s kennedy had a whole smorgasbord of guns and gear to carry and he did so by rotating items across a grid big and powerful things cover more space but clever players could also pack their case with small useful items like herbs and ammo it was a very small but satisfying part of the game and pc gamer recently highlighted a tribute to that mechanic called save room organization puzzlesave room has the player take the role of a protagonist in a horror game but only at the brief moments where the hero gets to rest wounded and weary and clear their head in order to survive until the next safe spot youll need to organize your gear for the next levels the player has to neatly rotate and place a selection of items across the grid to pack their bagsthe game has some fun puzzles like hauling around a case full of endgame gear or having to mix or consume certain items just to score some more sweet sweet space if you love creating an efficient loadout this is basically the game for you and its currently under two dollars on steam,en,146,Positive
polygon,2022/05/04,https://www.polygon.com/23055472/fifa-22-cross-play-cross-platform-support-test-fifa-23,"FIFA 22 begins cross-platform test soon, pointing to full support in FIFA 23",ea sports will soon test crossplatform multiplayer in fifa pointing to the likelihood that this falls fifa will implement crossplay in all modes for the first time in series historythe crossplay test will involve the playstation xbox series x and google stadia versions of fifa and will cover matches in the online seasons and online friendlies mode online friendlies are oneoff matches against human opponents online seasons combines a number of friendlies to move players up or down through ranked divisionsea sports said on tuesday that the trial will begin in the near futurewhile we want to enable our players to play with as many friends and others as possible we limited the test to these two modes with the aim of reducing the chance for introducing new issues into the game goran popovic an ea vancouver said in an faq we are confident that the game data and feedback that we get from these two modes will help inform how crossplay could further be implemented in future titleswhen the crossplay test arrives via update players will notice a widget in the bottom righthand corner of the main menu following its button prompts will enable or disable crossplatform play there is also an optinoptout toggle in the matchmaking options settings screeninsiders and influencers back in march and april speculated that crossplay would be tested this year and implemented fully with the next fifa ea sports benchmark title is one of the last major multiplayer games without crossplatform support which began in earnest in the fall of when sony allowed playstation users to play fortnite against players on other consolespopovic in the faq said the crossplay test does not have any direct impact on the gameplay of fifa that said it should significantly boost the matchmaking opportunities for the google stadia version of the game which has a dramatically smaller installation base than the consoles or windows pcfifa just became available to playstation plus subscribers for the month of may however it is the playstation version of the game playable on playstation through backward compatibility this test is only for the native playstation version of the game,en,192,Negative
