name,date,url,header,content,lang,total_word,sentiment
polygon,2022/05/04,https://www.polygon.com/22927514/best-shows-2022-tv,"The best TV shows of 2022, so far",were only partway through the year and is already absolutely packed with new shows unlike the other best of lists weve put out movies games anime tv is more of a constant deluge these days with a fountain of streaming services sharing more shows than a reasonable person could keep up within light of that were here to help you suss out some of the best shows of the year so far that last part is key this is a list we expect to update several times through the year as new shows drop older shows settle into our memories and we like everyone else catch up on the unsung gems of counts as a show glad you asked any show where the season in question ended in and dont fret if it looks like your favorite show is falling down the list this list is in newest first order so new additions will be added to the top as they make the cutviewers who tune into david jenkins pirate comedy our flag means death because theyve heard so much about thor ragnarok and hunt for the wilderpeople director taika waititi in the show or about its tender bromanceturnedromance may be surprised to learn that neither of those elements really kicks in until episode of a run jenkins explained to polygon why that had to happen to make the story work but the result is that viewers who want the series full emotional impact have to stick with it through some light early comedy that recalls the early episodes of what we do in the shadowsthat comedy has its own charms and sets a lot of important gears in motion but it also only teases at our flags full powerful impact as waititi and his longtime partnerinmovies rhys darby playing comic versions of reallife pirates blackbeard and stede bonnet both endure personal identity crises and find the answers in each other our flag never stops being tongueincheek for long and the parade of comedy ringers pulling cameos including leslie jones fred armisen will arnett nick kroll and kristen schaal keeps the action lively but by the end of the first season its also a sweet smart invitation for viewers to run off and become pirates themselves or at least examine their assumptions about their own lives and loves tasha robinsonour flag means death is available to watch on hbo maxranking of kings is a fantasy series where monarchs are measured by their deeds and more importantly their strength enter bojji a tiny warmhearted boy who is next in line to take on the throne from his ailing father who is king bojji isnt physically strong and struggles to speak thus leading him to communicate primarily through sign language however where his characteristics might lack in comparison to other more traditional leaders he makes up for in heart in the first episode he literally takes the shirt off his back for someone in needbojji is one of the most moving and compelling anime protagonists ive seen on screen ever ranking of kings charges even the most banal of moments with the highest stakes it makes a nonlethal spar between bojji and his halfbrother somehow feel more important than a fight between gods he makes for the perfect protagonist as his tiny stature and sense of awe make a sweeping fantasy land populated with golems wizards and giants feel all the more grand that being said bojji is far from being the only character who stands out alongside him is his companion kage who is the sole survivor of a oncepersecuted clan as well as his halfbrother daida who struggles to find a way to power that feels true to himranking of kings works because i would die for bojji however this series is more than an underdog story based on the manga written and illustrated by sosuke toka the anime nails all the fixings of a great fantasy series intriguing creatures mystical and dark magic palace intrigue and an adventure that takes the little lad to the depths of hell its an incredible series so far and one that i cant recommend enough ana diazranking of kings is available to stream on funimation and crunchyrollthe sitcom mockumentary format has been done to death at this point but against all odds abbott elementary manages to refresh that formula and breathe new life into it it just makes sense that a school would be the subject of a documentarythe best part of abbott elementary is that each of the teachers just feels real like a teacher you probably had at one point or another in your life sheryl lee ralph and janelle james command the cast as wise kindergarten teacher barbara and workallergic selfabsorbed principal ava but from eager and sometimes nave janine quinta brunson also series creator to street smart philadelphia native melissa lisa ann walter all the characters are vivid messy and relatable in their own ways and they all learn from each other so no one person is the butt of all the jokes and instead they have their own separate strengths and weaknesses and separate quirks about them that make them hilarious also the added bonus of the kids being absolutely adorable makes abbot elementary particularly special petrana radulovicabbott elementary is available to watch on huluseverance doesnt seem like it should work as well as it does every bit of the scifi thriller from its tightly tuned performances to the evocatively lowkey score even to the concept of the show itself feels like a highwire act a series of plates spinning atop sticks and staying perfectly balanced the world where lumon industries has allowed or more disquietingly required workers to sever their work and home identities is trippy and methodic like an escher painting come to lifeafter all what do your work and personal self have in common beyond just happening to be the same person as severance unpacks just how different those interests are the result gets more and more chilling as it expertly reminds us of what is actually lost even in the cleanest of worklife balances zosha millmanrelatedseverance is available to watch on apple tv pluswhen best friends amy eliza coupe jodie ginnifer goodwin and sarah maggie q lose their friend colleen the middleaged trio vow at her funeral to stop wasting their precious time and do the things theyve been putting off sarah quits her career as a surgeon and starts working at a grocery store amy stops using her career as an excuse to hide from her family and jodie decides to be more impulsive and flirt with her personal trainerdespite the unusually dark premise and drasticseeming pilot pivoting is a breezy sharp comedy that mostly stands out in how grounded its characters are not necessarily in their decisions and uppermiddle class lifestyle but in their wartsandall friendship one where they all care about each other but also know making new friends is just too much work to do anything other than support each other even when one of them is being an idiot joshua riverapivoting is available to watch on hulustop me if youve heard this one a sitcom built around a group of friends who hang out have a good time and get into wacky hijinks together grand crew one of nbcs newest halfhour comedies certainly follows suit it follows a group of black friends in la who hang out together at a wine bar shenanigans ensue but its more than just a singular entry to the longlist of hangout shows its an incredibly solid onethe only weakness of the cast is also their strength they anchor the show with an incredibly clear handle on who their characters are it can feel at times like the show is putting the cart before the horse the cast comes on strong and funny while the show is left to catch up to them but unlike other returnstositcom that end up feeling like relics grand crew lets its cast feel like theyre really playing like wine and all great sitcoms it starts strong and only gets better with age heres to uncorking another season and letting the characters grow even more zmgrand crew is available to watch on hulu and peacockdanny mcbrides raunchy story of american failchildren reached new heights and excesses in season adding jason schwartzman and eric andre to a cast already stuffed to the brim with comedic talent as my esteemed colleague joshua rivera put it a single danny mcbride episode will often say more about america than an entire season of one of your little rich people dramas and have a great fart jokethe second season of gemstones builds on the foundation of the first season and continues to hold its place as cantmiss television especially if youre okay with the occasional vomitbased gag it introduces new context for the upbringing and background of family patriarch eli john goodman linking the showmanship of pro wrestling directly to the theatricality of evangelical megachurch shows all while methodically cataloging the repeated failures of his hilariously inept children to build their own legacy mcbride and co highlight the absurdity of our current moment with comedy that is at once astutely observant and uproariously vulgar pete volkthe righteous gemstones is available to watch on hbo maxin a television world stuffed to the brim with police procedurals and movies cut into onehour increments all creatures great small stands apart as a charming veterinary serial set in the lush yorkshire dales countryside the second season of all creatures retains and builds on the appeal of the first season with top production design beautiful cinematography and complicated characters filled with lifeour central characters branch out from their established molds from the first season too james nicholas ralph is prioritizing what he wants in life and where home is siegfried samuel west is figuring out how to show his brother he cares about him tristan callum woodhouse is mostly growing up and becoming an adult and mrs hall anna madeley is recapturing her identity as her own person all of the actors are phenomenal led by woodhouse and madeley who are each given significantly richer material to work with this seasonwith world war ii looming on the horizon the second season of all creatures brings into focus one of the main themes of the show the little but significant ways in which we can make a difference in the lives of those around us animals and human alike as the characters often remind us being a good veterinarian is not just about the animals its the people thats the difficult part a loving ode to the original series and books with one of the most charming opening credits sequences on tv all creatures is about the difficult worthwhile pursuit of caring for all living things around us as best we can pvall creatures great small is available to watch on pbs masterpieceif guardians of the galaxy showed how james gunn could paint within the lines to form one of the better mcu scripts then peacemaker shows what he can accomplish when given relatively free rein the cstring hero peacemaker was best known for inspiring watchmens comedian or being the consummate asshole of the suicide squadpostpeacemaker gunn showed him in all his human glory flawed intense wounded caring an impeccable dancer bisexual vigilantes best friend throughout it all john cena as peacemaker manages to finetune some genuine pathos while also anchoring a rocksolid cast adept at gunns tonal swings at this point its one of the few superhero projects that feels easy to root for the next chapter of heres to many more eagle hugs zmpeacemaker is available to watch on hbo maxno one is more game than marshawn lynch when they come to murderville the former nfl running back may get high marks just because his seamless transition into comedy king is something of a surprise but he earns this episodes place on this list with every firedoff quipwhats great about lynchs performance is that he is totally down to clown around when it comes to the scenarios who knew hed make such a good mirror to rob huebel but also makes the whole thing feel like a buddy cop comedy whether hes backing up seattles doll dna suggestions or defending the timehonored procedural crosstalk then act like you cant he yells at the witness who says he can hear everything theyre saying lynch puts the team on his back and just runs with it zmrelatedthe marshawn lynch episode and the rest of murderville is available to watch on netflixafter nearly years since his last original anime dennou coil director mitsuo iso returns with the orbital children a sixepisode anime released in japan as two featurelength films following the story of five children stranded aboard a commercial space station on the brink of a cataclysmic disaster through a dizzying tapestry of rich worldbuilding brought to life through beautiful animation iso and co weave a comingofage story that takes the lives of five unsuspecting children and places them at the precipice of humanitys expansion into the vast unknown of space its a brilliant anime with dense beautiful visuals that rewards both attentive firsttime viewers and repeat watches alike toussaint eganthe orbital children is available to watch on netflixno show arrived with as much pizzazz in late as yellowjackets did with a pilot directed by karyn kusama the show jumps between a group of teen girls in the stranded in the wilderness after their plane crashed en route to a soccer tournament and their older counterparts each still coping with the traumatic experience and also being mysteriously blackmailed by someone about their time in the woodsyellowjackets is creatively confident from the jump deftly balancing its highwire act and slowly unfurling its grand designs even when you have no idea what to make of them even with a slightly mellow by their standards finale yellowjackets season will have my full attention whether its handling messy characters woodsy abortions or supernatural cultism yellowjackets is clearly top of the class zmyellowjackets is available to watch on showtime anytimethere is perhaps no show easier and harder to recommend to people this year station eleven based on the novel of the same name traces a handful of characters as they live through a deadly pandemic and figure out what life after looks like its pilot is immediately gripping thanks to careful writing and images that sear themselves into your mind it is also of course horribly timed given the ongoing pandemic and the waves of unresolved grief that wash around our ankles every minute of the dayand yet station eleven is one of the most beautiful things start to finish tv has gotten this year as nicole clark put it in her lookback at the seasonstation eleven is that rare piece of pandemic media that dwells less on the heroism of a solution or the thrill of a core cause and more on the idea of the persistence of community and the creation of art even as the show forges numerous circuitous connections between its characters much of its plot is left openended the shows vignettes work out more like a collage that convey emotional tones survival is insufficient is more than a mantra painted on the side of the troupes wagon its a thread that binds episodes together its a reason to stay alive at allit might not always be the easiest of watches but its among the most rewarding zmstation eleven is available to watch on hbo max,en,1114,Positive
polygon,2022/05/04,https://www.polygon.com/22929136/polygon-newsletter-patch-notes-subscribe-here#comments,Polygon’s newsletter will make your weekends even better,polygon is launching a newsletter with a mission you should never have to scroll through streaming services skim over metacritic or swipe through your social media feeds to decide what to watch play or read next because every minute you burn scrubbing over netflix is a minute you could have spent enjoying a new game on switch or discovering ranking of kings an early contender for anime of the yearwere calling the newsletter patch notes and heres how it works each friday well share our favorite new movies video games television shows comics anime manga and tabletop rpgs well also include a link to a new free game and curate some of our favorite recent stories on polygon including reviews explainers and guides so you can make the most of your weekends entertainment best of all its freeour first issue of patch notes will hit inboxes on friday march ill be penning the first few issues but in the coming months a variety of polygon writers and editors will be your tour guides illuminating the dark twisted tunnels of mediasubscribe todaya weekly roundup of the best things from polygonplease check your email to find a confirmation email and follow the steps to confirm your humanity,en,138,Positive
polygon,2022/05/04,https://www.polygon.com/23055141/warcraft-universe-mobile-game-reveal-blizzard-entertainment,How to watch the Warcraft mobile game reveal,blizzard entertainment will reveal a brandnew mobile game set in the warcraft franchise on tuesday may the game will be announced as part of a livestream which you can watch on blizzards youtube channelparent company activision blizzard has said to expect the new warcraft mobile game sometime in it will be blizzards second mobile launch this year following the release of diablo immortal which is also coming to pc in juneto date the only mobile presence for warcraft a franchise more than years old has been in in hearthstone that freetoplay game arrived on ios devices in april and for android devices at the end of that year but hearthstone is a cardcollection game altogether different from the actionrpg experience of world of warcraft or the realtime strategy of the first three warcraft titlesbut diablo and warcraft arent the only blizzard franchises that could come to mobile back in blizzard cofounder and senior vp allen adham said we have many of our best developers now working on new mobile titles across all of our ips some of them are with external partners like diablo immortal many of them are being developed internally only and well have information to share on those in the futurewe have more new products in development today at blizzard than weve ever had in our history and our future is very brightits already been a busy year of announcements from blizzard in january the company announced a brandnew survival game for pc and console which was followed by the reveal of a beta test for overwatch in march and a new expansion for world of warcraft dragonflight in april,en,147,Positive
polygon,2022/05/04,https://www.polygon.com/22971124/avatar-2-trailer-release-date-doctor-strange-2-sequels-pandora#comments,Avatar 2’s first trailer is missing the magic of the original movie,after long years and endless delays and date shifts its finally time to return to the world of pandora with the followup to avatar the first trailer for avatar the way of water will play in front of doctor strange in the multiverse of madness and thatll be the only official way to see it for at least the next weekthe sequel brings back sam worthington as jake sully and zoe saldaa as his navi lover neytiri and the first trailer strangely enough focuses on them instead of on the beautiful alien world of pandora avatar is set for release on dec provided an advance look at the trailer ahead of preview screenings of doctor strange attendees of cinemacon an industry event for theater owners and operators held last week in las vegas also got to see the first avatar teaser in advancethe first trailer for avatar is largely wordless carried instead by the soaring music you might expect if you remember the first movie well its primary focus is on the navi and the avatars the navi bodies genetically engineered by humans and operated via remote brain interface the trailer features numerous shots of navi in closeup riding alien animals walking with humans and standing in or running through humanmade structures in other words the trailer doesnt feature nearly enough of pandorawhen the original avatar was released in the blue cgi navi characters looked great with stunning facial expressions and surprisingly believable movements but its real enduring power lay in the beauty and majesty of pandoras digital landscape after all the planet was so gorgeous that some people reported feeling deeply depressed because they couldnt live there themselves its even the basis of a wildly successful disney world locationavatars earliest trailers focused on the beauty of pandoras flora and fauna there were floating islands covered in vibrant flowers and massive trees strange alien creatures that seemed like crosses between panthers and lions and huge flying beasts that took the characters and more importantly us on a soaring journey to tease some of the planets breathtaking terrainthe first trailer for avatar the way of water misses out on that majesty by spotlighting the characters the trailer reduces pandora to a banal backdrop that could be any forest or ocean on our own planet apart from the emphasis on fourfinned or fourwinged creatures there are brief shots of numerous new characters who all look great once again these characters are frequently riding creatures but the camera is tightly focused on them obscuring their mounts and leaving the watery expanses of pandoras new regions looking blandthe good news is that what little we do see of pandoras new mostly aquatic regions still looks incredible the digital rendering is even more impressive than in the first movie and it seems clear that there will still be plenty of glamorous shots of the planet but its harder to get excited about returning to the world of pandora when we barely get to see it and its not like the trailer focuses on plot instead of environments there are no clear story elements here apart from a single voiceover line from jake about how family is a fortressalong with some other returning cast members like sigourney weaver and giovanni ribisi avatar will add a variety of new actors and characters including kate winslet and michelle yeoh some of the actors have told stories about their experiences shooting the movie which sounded like an absolute nightmareto help prepare audiences for avatar the way of water disney is rereleasing the original avatar in theaters starting on sept james cameron has said in the past that he plans to make as many as five avatar films and has even apparently shot several of them as of right now the movies are scheduled to come out every two years from now until so disney will have many more shots at making trailers that focus less on unnamed characters doing unclear things and more on the world that the filmmakers are inviting us to revisit,en,351,Positive
polygon,2022/05/04,https://www.polygon.com/23053795/nemesis-lockdown-digital-steam-release-date-price,Hit survival horror board game Nemesis Lockdown arrives on Steam this month,the nemesis series of survival horror board games is being adapted to the pc developer awaken realms made the announcement tuesday morning in a news release titled nemesis lockdown the pc game boasts both a solo and a multiplayer game mode its expected to launch into early access on steam starting may is a semicooperative board game heavily inspired by the alien movie franchise players are each dealt private objectives which may include betraying the other players at the table its solid mechanics and gorgeous miniatures have helped it to earn a solid reputation among fans of hobby board games the project was originally funded on kickstarter and brought in more than million in its sequel nemesis lockdown did even better with nearly million in digital adaptation is designed by interstudio the company behind the companion app for the original nemesis board game,en,99,Negative
