name,date,url,header,content,lang,total_word,sentiment
polygon,2022/05/04,https://www.polygon.com/23055050/xbox-game-pass-may-2022-games-list-pc-cloud-android-ios-citizen-sleeper,Citizen Sleeper and two more indies make same-day Xbox Game Pass launches in May,citizen sleeper the scifi roleplaying game and a polygon recommends selection in tuesday mornings review launches may and will be available to xbox game pass subscribers the same day it joins loot river an id dungeoncrawler that also launched tuesday and is a dayone game pass selectionboth loot river and citizen sleeper are available to cloud console and pc subscribers loot river is an action roguelike that puts the player in procedurally generated labyrinths where they can nonetheless push stone blocks and manipulate other features to find their way through the levelrelatedcitizen sleeper by jump over the age uses a diceroll system inspired by tabletop rpgs in it the player is fleeing a dystopian megacorporation which has scheduled their body for planned obsolescence players take one of three classes and spend their time aboard a space station trying to create a new life while preserving their old oneother games coming to xbox game pass in the first half of may include nhl available to xbox game pass ultimate subscribers via ea play on may the latest edition of ea sports hockey simulation arrives just in time for the stanley cup playoffs the first games were played monday nightthe rest of the titles joining game pass libraries by may arerelatedthe rotation of new games coming in the next two weeks means seven others will be leaving soon grand theft auto san andreas the definitive edition the remaster of rockstar games landmark work is departing may on may enter the gungeon final fantasy hd remaster remnant from the ashes steep the catch carp and coarse and the wild at heart all leave game pass subscribers can buy them at a discount before they go,en,176,Positive
polygon,2022/05/04,https://www.polygon.com/23055017/fortnite-lightsabers-star-wars,Lightsabers return to Fortnite just in time for May 4,just in time for may the fourth lightsabers and other star wars items are returning to fortnite from now until may various star wars items from years past will be available in the game with some outfits back in the shop as wellthere are four lightsabers available to find throughout the fortnite world luke skywalkers green lightsaber kylo rens red lightsaber mace windus purple lightsaber and obiwan kenobis blue lightsaber just in time for the disney plus show premiering later this month additionally the blaster rifle will also be in the game all the star wars weapons can be used in the game like regular fortnite weaponsthe returning outfits include an imperial stormtrooper kylo ren zorii bliss finn rey a sith trooper boba fett fennec shand and krrsantan if your favorite star wars fortnite outfit is missing like the mandalorians armor then it was probably a previous battle pass item those wont be coming back just yetin addition to all the sweet weapons and new garb there will also be various star warsrelated quests active till may completing five of those will earn you a special empire banner for more details check out the fortnite blogreturning to fortnite from a galaxy far far awaylightsabers are back hop in now to use the lightsaber item complete limited time quests and moreaccess more ,en,136,Positive
polygon,2022/05/04,https://www.polygon.com/23054059/blade-runner-tabletop-rpg-kickstarter-preview-price-launch-date-delivery#comments,Blade Runner tabletop RPG will ask players to grapple with their own humanity,a crowdfunding campaign for blade runner the roleplaying game one of polygons most highly anticipated tabletop rpgs of launches tuesday developed by awardwinning publisher free league in collaboration with alcon entertainment and genuine entertainment it sends players into the streets of los angeles in the year as members of the lapds repdetect unit better known as blade runners we spoke with lead designer and free league cofounder tomas hrenstam to learn morea lot of the surface gameplay is investigation said hrenstam players will be going to places talking to people collecting evidence a big source of inspiration was sherlock holmes consulting detective and other classic mysterysolving gamesof course every good blade runner story needs its protagonists to grapple with existential questions between casesits a point that the source material makes said hrenstam that your humanity isnt decided by whether youre human or replicant its not defined by your origin its in your actions and what you choose to do and thats really the path that weve followed in designing the game that path is clear in the process of character creation which asks players to generate a key memory and define a key relationship both of which shape how their character engages with the world finding ways to interact grapple with these key elements during sessions will allow players to earn humanity points which can be spent to gain skill levelsbetween morally ambiguous casework players will spend a lot of their ingame time performing down time activities these narrative interludes will allow characters to go their separate ways and explore their lives outside of the lapd it gives us a spotlight into the personal lives of these characters hrenstam said down time is where mechanics like key memory and key relationship come into play and those function in the same way regardless of if youre a human or a replicantthe core rulebook contains over pages of worldbuilding immersive details and the official blade runner ruleset not to mention gorgeous art by martin grip fans will recognize his distinctive style from other free league projects including the one ring roleplaying the world of the lord of the ringsfans of alien the roleplaying game tales from the loop and forbidden lands will recognize the games year zero engine which appears in a new and developed form tailored to the neonnoir setting the original year zero engine involves a pool of sixsided dice for each roll with a six on one or more dice indicating a success more sixes mean a higher success and the dice pool increases as player skill and attribute levels increasein blade runner the mechanic has been streamlined players are equipped with just two dice one each for the base attribute and skill associated with the roll increases in player competence are reflected in the kind of dice used ranging from to hrenstam says this was to keep the game rules lightwe didnt want the rules and the dice to dominate the table too much he said so we decided to scale down the feel of the dice and the mechanics so that theyre a little more in the background than in some other year zero gamesalso included in the kickstarter materials is the first cinematic module for blade runner an adventure titled electric dreams game runners are given everything they need to create their own case file in the core rulebook but electric dreams serves as the perfect introductory module to help players and game runners settle into the worldwe didnt want to railroad players said hrenstam thats why players can interact with the materials presented to them in electric dreams and other case files in any way theyd like every case file is an interconnected web of clues locations npcs evidence but players will have a lot of freedom to go where they want and talk to whoever they want and in how they arrive at a solutionany backers that pledge at the core rulebook tier or higher within the first hours of the kickstarters launch will also receive an exclusive art print by lead artist grip the repdetect bundle contains the standard core rulebook and the blade runner starter set which includes a condensed rulebook a print version of electric dreams four pregenerated characters for players to jump right in and a selection of physical handouts representing data files photos and evidence for use during the investigationalso exclusive to the kickstarter is the deluxe collectors edition of the core rulebook available in the offworld bundle this special edition boasts a fauxleather cover embossed with a holographic stamp of the japanese kanji for origin and will not be printed again for players short on chinyen the diji bundle contains pdf versions of the core rulebook and electric dreams digital versions will also be made available to all backers at higher tiers shortly after the kickstarter endsstretch goals include additions to the starter set such as custom dice an initiative card deck a fullcolor map of future los angeles extra character archetypes such as the doxie and the cityspeaker generator tables for case file and key memory creation and crime scene photos with hidden clues for players to findplayers hoping for a cutanddried mystery game should definitely look elsewhere hrenstam says its not just going to be solve the case go home and be happy thats never going to happen in this game its always going to be more complicated than thatthe kickstarter campaign for the blade runner rpg will run until may ,en,429,Positive
polygon,2022/05/04,https://www.polygon.com/23054046/bioware-qa-contractors-unionize-keywords-studios-union-vote#comments,Why BioWare contractors in Canada are trying to unionize,quality assurance workers employed by contractor keywords studios whose clients include bioware were motivated to organize a union because of a returntooffice order that would mean hundreds of dollars in commuting expenses for employees mostly making minimum wage one of the organizers told polygonlast week the alberta canada labour relations board informed keywords studios that its edmonton qa employees were organizing under the united food and commercial workers canada union local no to be their collective bargaining agent tuesday may is the deadline for their employer to file any objections to the unions formation assuming there are none a vote should be scheduled within two weeks and if of the keywords testers vote yes they will begin bargaining a contractkeywords would be the second video games developer in north america to have workers organized into a collective bargaining unit twentyone raven software qa workers located in wisconsin began voting on friday on whether to form a union called game workers alliance those votes will be counted may studios founded in is headquartered in ireland and maintains more than offices worldwide keywords studios in edmonton is managed by the companys british columbia office keywords provides technical services in art audio games development localization and quality assurance but does not develop or publish games itself bioware owned by electronic arts since is among several aaa studios and publishers in the companys clienteleone of keywords organizers who asked not to be identified as our management doesnt know whos involved with the effort at this point said that their vote could involve between and employees pending a labour board review of eligible positions regardless this organizer is heavily confident that we will achieve a union we should be easily able to overcome this vote thresholdthe organizer said that the raven workers actions well publicized in the games press were somewhat an inspiration mainly in showing them that it was possible to take action the actual reason for starting a union they said stemmed from unhappiness with low wages and then a returntowork policy that will add significant monthly parking fees and other commuting costs to a job still paying them the same wage that it was just a few weeks agoour entry level testers start at minimum wage which in alberta is an hour a onebedroom apartment is about here in edmonton paid twice monthly the organizer reckoned that many of their colleagues take home between and each paycheckmeanwhile according to organizers workers in other departments have been granted more flexibilitywhile our studio counterparts over at bioware theyre getting a little more of a hybrid model flex hours or permanent workfromhome options it wasnt really being afforded to us the organizer said so some of our members felt that maybe we can have a little more of a conversation about thispublic parking which workers are expected to cover themselves runs between and a month they said thats before youre buying yourself groceries and all the other expenses they said workers had avoided this and other commuting costs by working from home since the pandemic emptied out offices in the spring of organizer said they have worked for keywords for two years and gotten a raise to an hour but they like most of the workers who would vote on a union started their testing job during the pandemic and have not gone into biowares office to work alongside its developers over the past two years keywords qa in edmonton assisted on mass effect legendary edition which launched last may as well as the legacy of the sith expansion that launched for star wars the old republic this february currently keywords qa workers are working on the next dragon age the organizer saidmany of our individuals have things like student loans they said just like down in the united states postsecondary education is not free up here either they said most of their colleagues had fouryear university degrees and those that didnt likely had studied at a technical college the university of alberta a well regarded public university there in edmonton is often a feeder to the local tech industry games development includedit really resonated with a lot of our members that we are viewed as unskilled labor minimum wage you get to sit around and play video games all day right the organizer said but i think the reality that most people dont understand is how highly technical the qa industry is and a lot of these individuals who are working on our team these are people who are coming out of university with computer science degrees and just trying to get started in the industrytheyre highly talented individuals that are creating immense wealth for their employer at the expense of themselves they added,en,387,Positive
polygon,2022/05/04,https://www.polygon.com/23054859/meta-vr-headsets-roadmap-cambira-quest#comments,Meta to release a ‘laptop for the face’ and 3 more VR headsets by 2024,according to a detailed report from the information meta plans to release no less than four new virtual reality headsets between now and the end of as the facebook parent company aggressively pursues founder mark zuckerbergs vision for the metaversethe internal roadmap seen by the information says the first of these headsets is due to be released around september this year its codenamed project cambria and is a highend vr and mixedreality standalone device that will be sold as a tool for remote work rather than for gaming in an earnings call last week zuckerberg said that the focus for cambria was eventually replacing your laptop or work setupkey to this is very highresolution image quality that will make it easy to read and write text inside the headset cambria also uses outwardfacing cameras to pass through a view of the users reallife surroundings enabling mixed reality as opposed to full virtual reality experiences these features coupled with its relatively low onboard processing power differentiate cambria sharply from other highend headsets like vive pro which are designed primarily for gaming and require a powerful pc to operate insiders at metas reality labs call the device a laptop for the face cambria will reportedly be priced at or highernext after cambria in will be a new version of metas lowend quest headset which currently starts at then in both cambria and quest will be refreshed with further new versions at least thats metas plan according to the informations report the social networking company is struggling to adapt to life as a maker of hardware and operating systems which along with supply constraints has caused frequent delays to its planned push into vr as well as to the augmented reality glasses it is developing in parallelmany other challenges face zuckerbergs quest to have us all joining work meetings through vr goggles in metas horizon workrooms app one is compatibility for metas custom vr operating system with common workplace software another is the sofar unproven public appetite for vr or for zuckerbergs vision of the metaverse as an immersive pervasive vr internet where people will work socialize and shop using avatars but the meta ceo is taking a long view during the recent earnings call he said meta was laying the groundwork for what i expect to be a very exciting ,en,225,Positive
polygon,2022/05/04,https://www.polygon.com/22929136/polygon-newsletter-patch-notes-subscribe-here,Polygon’s newsletter will make your weekends even better,polygon is launching a newsletter with a mission you should never have to scroll through streaming services skim over metacritic or swipe through your social media feeds to decide what to watch play or read next because every minute you burn scrubbing over netflix is a minute you could have spent enjoying a new game on switch or discovering ranking of kings an early contender for anime of the yearwere calling the newsletter patch notes and heres how it works each friday well share our favorite new movies video games television shows comics anime manga and tabletop rpgs well also include a link to a new free game and curate some of our favorite recent stories on polygon including reviews explainers and guides so you can make the most of your weekends entertainment best of all its freeour first issue of patch notes will hit inboxes on friday march ill be penning the first few issues but in the coming months a variety of polygon writers and editors will be your tour guides illuminating the dark twisted tunnels of mediasubscribe todaya weekly roundup of the best things from polygonplease check your email to find a confirmation email and follow the steps to confirm your humanity,en,138,Positive
polygon,2022/05/04,https://www.polygon.com/23053439/squishmallows-cottagecore-cozy-game-deck-builder-roguelike#comments,This game tests the limits of cuteness with its round animals,oh to be a giant spherical frog soaking in a pool of crystalline water i will never know that joy firsthand but at least games like puff pals island skies can transport me into that world in this adorable game you can explore and make friends with animals like a giant frog the size of a boulderwe have enormous amphibians and more in cool wip polygons weekly roundup of eyecatching clips and screenshots of works in progress each week the polygon staff scours the internet for the most interesting games still under construction to give you a sampler of the coolest upandcoming projectsthis week we have a stealth game featuring a raccoon a deck builder with sea creatures an adorable trading sim and one very wiggly caterpillara good morning shower for bean getting so close to multiplayer fluffnest posted a clip from its dreamlike farming and exploration game puff pals island skies the creatures are downright adorable and look like the popular stuffed toys squishmallows with their round and plump design previous trailers showed off farming and exploring its glowing world but a new clip showed a friend you might encounter while exploring a giant frog thats just vibing puff pals is currently in development and you can check out everything planned on the games kickstarter page sparks is a digital artist and game developer making a game called snaccoon sparks posted a little scene showing a raccoon lovingly called a trash panda walking through a street in a developers blog sparks says that its part of an ongoing side project thats a stealth and exploration game where you play as the critter the animation looks absolutely adorable and shows the raccoon trotting along the street you can follow sparks work on twitterhey you know that astrea alpha is currently on g round available for playtesting come play it and give your opinion to help us improve the game sixsided oracles fuses dice and deckbuilding mechanics with a roguelike the game created by little leo games features fighters inspired by ocean critters like squids nudibranchs crabs and more the character designs are stellar so if youre an ocean nerd or into deckbuilding be sure to check it out a clip from the developer shows a giant axwielding hammerhead shark facing a mysterious cloaked squid you can find more information on the game on its steam pagelook at her go the queen bee is a natural dancer is a trading sim where you travel around a map to trade with and discover new towns developed by whales and games its art style makes the entire game look like an adorable coloring book from the looks of it you can even change which air blimp you use to travel around however im partial to the sharkshaped one you can catch updates on the developers twitter accountbehold a procedurally animated caterpillar comrade smooth climbing and exploring at any angle on any surface while being cute and wriggly as hecc been a big couple of weeks for procedurally created creatures last week we saw a game that procedurally fused monsters together and this week we have a procedurally animated caterpillar a clip from a developer named joe showed the critter wiggling its way up and around tree branches joes page is full of other creepycrawlies so check out his twitter page for more of his work,en,297,Positive
